### ISSUE TITLE
Further documentation on example for std to provide some guidance

### ISSUE THREAD

**Issue by jubeormk1** [embassy-rs/embassy#4229]
Hi there,

I would welcome more documentation on the examples with std (`$EMBASSY_ROOT/examples/std/`) since `std` is a good playground. 

`e$EMBASSY_ROOT/examples/std/README.md` references **how to run the net.rs example**. Following the steps produces the expected results. However I would appreciate extra guidance with the example **tcp_accept** since there is some configuration missing to get this example running. I will go on more detail now.

## tcp_accept.rs

`$EMBASSY_ROOT/examples/std/src/tcp_accept.rs` starts a socket to accept TCP connections .

after running 

```sh
cd $EMBASSY_ROOT/examples/std/
sudo sh tap.sh
```
and running `tcp_accept` example with same parameters as `net` example:

```sh
cd $EMBASSY_ROOT/examples/std/
sudo cargo run --bin tcp_accept -- --tap tap99 --static-ip
```

I assumed that all I had to do is opening a connection to the IP address and port provided with a tool like netcat as easy as

```sh
nc -v 192.168.69.2 9999
```

But there is something missing as the connection is not establish.

I am running this examples on a fresh Ubuntu 24.04, ufw inactive, cargo 1.85.1 and embassy [up to date](https://github.com/embassy-rs/embassy/commit/7cbc9058bc726900571a7858c581f60cd8cb0266)

The example configuration should listen to the port 9999 but

```sh
sudo ss -tuln
sudo ss -tun
sudo ss | grep 9999
```

Does not show any reference to the port 9999. I have tried replacing the `tap99` IP address with the one used in the example `192.168.69.2` ending on a connection refused.
 
What am I missing?

**Comment by jubeormk1** [comment]
Thanks for your answer @brainstorm. I have not used any traffic monitoring tests. But I will now.

Full disclosure: **this time the example will work**.

My next test follow:

In console 1:
```sh
cd $EMBASSY_ROOT/examples/std/
sudo sh tap.sh
sudo tcpdump -i tap99
# '>' for stdout. After nc connection
> listening on tap99, link-type EN10MB (Ethernet), snapshot length 262144 bytes
> 16:26:15.188441 IP 192.168.69.100.48309 > 192.168.69.2.9999: Flags [S], seq 325132855, win 64240, options [mss 1460,sackOK,TS val 2536634167 ecr 0,nop,wscale 7], length 0
> 16:26:15.188753 IP 192.168.69.2.9999 > 192.168.69.100.48309: Flags [S.], seq 2990627175, ack 325132856, win 4096, options [mss 1460,wscale 0,sackOK,eol], length 0
> 16:26:15.188827 IP 192.168.69.100.48309 > 192.168.69.2.9999: Flags [.], ack 1, win 502, length 0
> 16:26:15.189015 IP 192.168.69.2.9999 > 192.168.69.100.48309: Flags [P.], seq 1:5, ack 1, win 4096, length 4
> 16:26:15.189026 IP 192.168.69.100.48309 > 192.168.69.2.9999: Flags [.], ack 5, win 502, length 0
> 16:26:15.689377 IP 192.168.69.2.9999 > 192.168.69.100.48309: Flags [P.], seq 5:9, ack 1, win 4096, length 4
> 16:26:15.689414 IP 192.168.69.100.48309 > 192.168.69.2.9999: Flags [.], ack 9, win 502, length 0
> 16:26:16.189528 IP 192.168.69.2.9999 > 192.168.69.100.48309: Flags [P.], seq 9:13, ack 1, win 4096, length 4
> 16:26:16.189562 IP 192.168.69.100.48309 > 192.168.69.2.9999: Flags [.], ack 13, win 502, length 0
> 16:26:16.689686 IP 192.168.69.2.9999 > 192.168.69.100.48309: Flags [P.], seq 13:17, ack 1, win 4096, length 4
> 16:26:16.689733 IP 192.168.69.100.48309 > 192.168.69.2.9999: Flags [.], ack 17, win 502, length 0
> 16:26:17.190003 IP 192.168.69.2.9999 > 192.168.69.100.48309: Flags [P.], seq 17:21, ack 1, win 4096, length 4
> 16:26:17.190035 IP 192.168.69.100.48309 > 192.168.69.2.9999: Flags [.], ack 21, win 502, length 0
> 16:26:17.690296 IP 192.168.69.2.9999 > 192.168.69.100.48309: Flags [R.], seq 21, ack 1, win 4096, length 0
```

In another console (2):
```sh
cd $EMBASSY_ROOT/examples/std/
sudo cargo run --bin tcp_accept -- --tap tap99 --static-ip
# '>' for stdout
> [2025-05-21T06:25:28.059189948Z DEBUG embassy_net] IPv4: UP
> [2025-05-21T06:25:28.060996974Z DEBUG embassy_net]    IP address:      Cidr { address: 192.168.69.2, prefix_len: 24 }
> [2025-05-21T06:25:28.061037277Z DEBUG embassy_net]    Default gateway: Some(192.168.69.1)
> [2025-05-21T06:25:28.061074486Z INFO  embassy_net] IPv6: DOWN
> [2025-05-21T06:25:28.061141181Z INFO  tcp_accept] Listening on TCP:9999...
> [2025-05-21T06:25:28.061198971Z INFO  embassy_net] link_up = true
# After nc connection
> [2025-05-21T06:25:37.375346507Z INFO  tcp_accept] Accepted a connection
> [2025-05-21T06:25:39.876949164Z INFO  tcp_accept] Closing the connection
> [2025-05-21T06:25:39.877084426Z INFO  tcp_accept] Flushing the RST out...
> [2025-05-21T06:25:39.877334554Z INFO  tcp_accept] Finished with the socket
> [2025-05-21T06:25:39.877378192Z INFO  tcp_accept] Listening on TCP:9999...
```
In one last console (3):
```sh
nc -v 192.168.69.2 9999
# '>' for stdout
> Connection to 192.168.69.2 9999 port [tcp/*] succeeded!
> 1!  2!  3!  4!  5!  %      
```

This time the messages from 'tcp_accept' and 'nc' show clearly that the example is working as intended. 'tcpdump' records the traffic but still `ss` does not show the port.

**Looking into this it might have been an issue with routes in the target computer**. `tap.sh` does configure routes for IPv6 but not for IPv4 explicitly. As I test it instruction by instruction, Ubuntu adds the route to `192.168.69.0/24` to the device `tap99` when the IP is assigned to the device. Somehow in my first test the route was not added.

In any case, adding the route manually also works.

```sh
sudo ip r add 192.168.69.0/24 dev tap99
```

I hope that this step by step troubleshoot of the example might help someone in the future. **Check the routes!!**
